{
  "schema_version": "0.1",
  "scenario_id": "basic_room_001",
  "time_s": 0,

  "compartments": [
    {
      "id": "room_01",
      "interface_height_m": 2.5,

      "upper_layer": {
        "temperature_c": 20,
        "o2_percent": 20.95,
        "co_percent": 0,
        "co2_percent": 0.04,
        "smoke_mass_kg": 0
      },

      "lower_layer": {
        "temperature_c": 20,
        "o2_percent": 20.95,
        "co_percent": 0,
        "co2_percent": 0.04,
        "smoke_mass_kg": 0
      },

      "hrr_kw": 0,
      "pressure_delta_pa": 0
    }
  ],

  "global": {
    "total_hrr_kw": 0,
    "ambient_temp_c": 20,
    "ambient_pressure_pa": 101325
  }
}