{
  "schema_version": "0.1",
  "scenario_id": "basic_room_001",
  "time_s": 210,

  "compartments": [
    {
      "id": "room_01",
      "interface_height_m": 1.18,

      "upper_layer": {
        "temperature_c": 480,
        "o2_percent": 16.7,
        "co_percent": 0.29,
        "co2_percent": 6.5,
        "smoke_mass_kg": 5.2
      },

      "lower_layer": {
        "temperature_c": 83,
        "o2_percent": 19.1,
        "co_percent": 0.04,
        "co2_percent": 1.5,
        "smoke_mass_kg": 0.61
      },

      "hrr_kw": 1300,
      "pressure_delta_pa": 6.2
    }
  ],

  "global": {
    "total_hrr_kw": 1300,
    "ambient_temp_c": 20,
    "ambient_pressure_pa": 101325
  }
}